질문, 맞장구(4~5점)
일을 하면 숨이 차다.,아이고 걱정이네요.,일을 하는데 체력 소모가 많으신가 봐요. ,너무 무리하지마세요. ,흠..걱정되네요.. ,일을 하는 데 무리가 많이 따를 것 같아요. ,함께 원인을 알아 봐요.,천천히 숨을 크게 들이쉬고 길게 내쉬는 심호흡을 반복해보세요. 도움이 될 거예요.,호흡 곤란에는 다양한 원인이 있다고 해요. 함께 원인을 알아 봐요.,과도한 신체활동은 주의하셔야겠어요.,일을 할 때 자세가 불균형한 건 아닌지 살펴보세요.,과로는 절대 금물이에요!
몸에서 열이 자주 난다.,아이고 걱정이네요.,저런… 많이 걱정되시겠어요.,환기가 잘 되는 옷을 입는 것도 도움이 됩니다.,덥다고 찬 음식만 먹는 것은 좋지 않아요.,얼마나 자주 열이 나는지 궁금해요. ,열 온도가 높아지면 언제든 말씀 주세요.,미열이든 고열이든 쉽게 볼 일이 아니예요. ,수분을 자주 섭취해 주세요.,수시로 몸의 수분을 보충하세요.,팥은 열과 땀이 많은 사람에게 좋아요.,땀을 자주 흘리시나요? 탈진하지 않도록 유의하세요.,피곤할 때에는 충분한 휴식을 취하세요.,실내온도와 습도 등 주위 환경을 적절히 조절해주세요.,열이 나면 체내 수분 손실이 많아 물을 자주 드셔야 해요.
말을 하고 나면 쉽게 목이 상한다.,아이고 걱정이네요.,저런… 많이 걱정되시겠어요.,쉬시면서 모과차 한잔 하세요.,따뜻한 차 한잔 어떠세요?,몸이 보내는 신호에 주의를 기울여 보세요.,목에 무리가 가지 않는 방법을 찾아야 해요. ,목 건강에 유의하며 말씀 하셔야 해요. ,잘못된 발성 습관을 갖고 계신가요? 너무 높거나 낮은 소리를 내거나 성대에 힘을 주고 말하는지 살펴보세요.,증상이 얼마나 지속되었는지 살펴 보세요.,목이 아플 때는 무엇보다 푹 쉬는 게 가장 좋아요.,충분히 수분을 섭취하는 것도 중요해요.,물을 조금씩 자주 마시는 것도 도움이 될 거예요.,목에서 힘을 빼고 말하는 습관을 가져보는 건 어떨까요?
기억력이 점점 떨어진다.,메모하는 습관을 들여보세요. ,기운내세요..점차 좋아지실 거에요. ,요즘 걱정이 많으신가요? 스트레스도 집중력과 기억력을 떨어뜨린다고 해요. ,중요한 내용을 시야가 닿는 곳곳에 메모해 두세요. ,제 기억력도 예전 같지 않아요. ,중요한 내용은 꼭 기록해 두세요.,연어와 아보카도를 챙겨 드시는 것도 도움이 된다고 해요.,충분한 휴식을 취하고 계신가요?,기억해야 할 일이 있다면 휴대폰의 메모장이나 캘린더를 활용해 보세요.
항문이 아래로 빠지거나 빠지는 느낌이 있다.,아이고 걱정이네요.,정말 걱정이네요.. ,그러한 느낌이 빈번했나요?,통증이 동반되는지 살펴보세요.,다른 증상은 없는지 궁금하네요.,평소 화장실에서 오래 앉아 계시진 않나요?,오랜 시간 무리하게 힘을 주는 배변 습관은 건강에 좋지 않아요.,따뜻한 물로 좌욕을 하는 것도 도움이 될 거예요.,화장실에 오래 앉아 있거나 과도한 힘을 주지 마세요.,평소 과일과 채소 같은 식이섬유를 충분히 섭취하고 계신가요?,장시간 앉아서 업무를 보거나 너무 오래 서 계시지는 않나요?,저와 함께 원인을 알아 봐요.
가슴이 두근거린다.,어머..무리하시면 안되시겠어요. ,걱정되네요..괜찮으신거죠? ,차 한잔 하시면서 휴식을 취해보세요.,걱정하지마세요..괜찮으실거에요. ,전에도 이런 일이 있었는지 생각해보세요. ,얼마나 오랫동안 두근거리는지 알 필요가 있어요. ,좋은 일로 인한 두근거림이면 좋겠어요. ,가슴 두근거림에는 다양한 이유가 있어요. 함께 원인을 살펴 봐요.,요즘 걱정이 많으신가요?,커피를 줄이는 것도 도움이 될 거예요.,통증의 유형과 빈도를 체크해 보세요.,적절한 휴식이 필요해 보여요.,카페인을 줄여 보는 건 어떨까요?
사소한 일에도 쉽게 놀란다.,근심이 많으시군요.,요즘 걱정이 많아서 그래요.,힘든일 있으세요?,작은 일로 놀라실 필요 없어요. ,괜찮아요. 사소한 일로 놀라지 않으셔도 돼요. ,사실 놀람은 감정보다 반사작용에 가까워요. 나를 돕는 기능이라 생각해보는 건 어떨까요?따뜻한 차를 마시거나 가벼운 산책으로 마음의 긴장을 풀어 주세요.
가슴이 답답하다.,요새 걱정이 너무 많으신거 아니에요? ,혹시..답답한 일이 있으세요? ,너무 무리하지 마세요. ,걱정되네요..괜찮으신거죠? ,스트레스를 많이 받고 계신가요?,같이 드라이브 나가요. ,너무 꽉 끼는 옷은 피하세요.,바람을 좀 쐬면 나아질 거예요.,좋아하는 음악을 들어보는 건 어떨까요?,스트레칭을 하면서 몸의 긴장을 풀어 보는 건 어떨까요?
어깨나 무릎에 관절통이 있다.,너무 무리하게 걷지 마세요.. ,어머..괜찮으신거죠? ,음..걱정되네요..무리하지마세요. ,요새 너무 무리하신거 아니에요? ,수영이 관절 건강에 좋대요. ,내일부터 수영을 배워보세요.,무리해서 걷거나 계단을 오르지 마세요.,찬바람에 유의하세요. 몸의 근육을 수축시켜서 통증을 심하게 해요.,몸이 보내는 신호를 무시하거나 참지 마세요.,좋은 자세를 유지하는 습관을 갖는 것도 도움이 됩니다.,관절에 스트레스를 주는 반복적인 동작을 주의하세요.,무리가 되지 않는 선에서 규칙적으로 스트레칭을 하세요.
자주 숨이 차다.,아이고 걱정이네요.,요즘 많이 힘드시군요.,어머..무리하시면 안되시겠어요. ,무리하지마세요. ,증상의 주기를 체크해 보세요.,내 몸이 어떤 신호를 보내고 있는지 주의를 기울여 보세요.,함께 원인을 알아 봐요.
귀에서 소리가 난다.,다른 증상을 동반하는지 살펴 보세요.,혹시 스트레스를 많이 받고 계신가요?,요즘 너무 무리하고 계시진 않나요?,충분한 휴식이 필요해 보여요.,간과하기 쉬운 증상 중 하나예요. 함께 원인을 알아 봐요.,제가 도움이 되었으면 좋겠어요. ,증상의 빈도와 유형을 체크해 보세요.,몸이 보내는 신호에 관심을 갖고 살펴보세요.,목 주변의 경직된 근육을 풀어주는 것도 도움이 돼요. ,카페인은 좋지 않아요.,충분한 휴식과 수면이 필요해요.
옆구리가 당기듯이 아프다.,함께 원인은 살펴볼까요?,너무 무리하지 마세요.,괜찮으세요?? 걱정되네요.. ,에휴..그러시군요. ,통증을 느낄 때에는 충분히 휴식을 취하세요.,통증의 정도가 궁금해지네요. ,통증을 자주 느끼시는 건 아닌지 걱정돼요.,원인 파악을 위해 온 마음을 다할게요.,많이 불편하시겠어요.,구부정한 자세는 증상을 악화시켜요.,다른 통증이 동반되는지 살펴 보세요.
소화가 안 된다.,차거나 자극적인 음식은 피하세요.,속이 더부룩하고 소화가 안 될 때 탄산음료를 찾는 건 좋지 않아요.,부드러운 음식을 드셔보는 건 어떨까요?,배는 소화를 돕는 효소가 풍부한 과일이에요.,커피와 튀긴 음식. 매운 음식은 피하세요.,과식을 주의하세요.,섬유질이 풍부한 음식은 소화에 도움이 돼요.,소화불량이 나타나는 데는 여러 가지 원인이 있어요.,소화에 부담이 되는 음식의 섭취를 삼가주세요.,식사를 할 때 천천히 소량을 드셔보는 건 어떨까요?
조금만 먹어도 속이 그득하다.,정말요? 살짝 걱정되네요. 질문 몇가지 더 드려볼께요.,식사를 할 때 천천히 소량을 드셔 보세요.,소화가 잘 되는 부드러운 음식을 드셔보는 건 어떨까요?,섬유질이 풍부한 음식은 소화에 도움이 돼요.,배는 소화를 돕는 효소가 풍부한 과일이에요.,섬유질이 풍부한 음식은 소화에 도움이 돼요.,팽만감의 발생 원인은 다양해요. ,불편한 부분이 있으시겠어요. ,불편을 덜어드리고 싶어요. 
식욕이 없다.,정말요? 살짝 걱정되네요. 질문 몇가지 더 드려볼께요.,입맛이 없을 때는 조금씩 자주 먹는 것이 좋아요. ,입맛이 없을 때는 비타민과 미네랄이 풍부한 채소와 과일을 섭취하세요.,아..그러시군요... ,입맛을 돋워주는 오미자차나 매실차를 추천해요.,입맛이 없을 때는 조금씩 자주 드시면서 천천히 양을 늘리세요.,입맛이 없다고 하시니 걱정입니다. ,날씨는 식욕의 증감에 영향을 준다고 해요.,저도 그럴 때가 있어요. 입맛을 돋워주는 음식을 찾아보는 건 어떨까요?,하지만 우리의 몸은 영양분을 필요로 해요.
속이 메스꺼워 토하고 싶을 때가 있다.,저런 걱정이네요. ,아이고..속이 쓰리시겠어요.. ,어머..걱정되네요. ,위장 관리에 유의 하셔야 합니다.,잦은 구토는 건강에 해로워요.,메스꺼움의 원인은 매우 다양합니다. ,혹시 스트레스를 많이 받고 계신가요?,음식을 지나치게 빨리 드시지는 않나요?,생강은 메스꺼움을 가라앉히는데 효과적인 음식이에요. 생강차를 드셔보는 건 어떨까요?,단백질이 풍부한 식사는 메스꺼움을 줄인다고 해요. 다만 너무 많은 양을 섭취하는 건 좋지 않아요.,허브티도 메스꺼운 증상에 도움이 될 거예요.,증상이 얼마나 지속되었는지 궁금해요.,다른 증상이 동반 되나요? 몸이 보내는 신호를 살펴 보세요.,매실차는 속을 편안하게 하는 데 도움이 돼요.
뱃속에서 “꾸르륵”하는 소리가 난다.,뱃속에 가스가 많은가 봐요. ,혹시 스트레스를 많이 받고 계신가요?,음식을 조금씩 여러 번 나눠 드세요. 소화에 도움이 되고 가스가 덜 생겨요.,껌을 피하세요. 껌을 씹는 동안 공기가 입으로 들어가 위장에 가스가 찰 수 있어요.,문득 빈도가 궁금해지네요. ,탄산음료는 좋지 않아요.,위장에 부담을 주지 않으셨으면 좋겠어요.,배에서 물소리와 같은 꾸르륵 소리가 들리는 것에는 다양한 원인이 있어요.,설사나 변비. 복통 등 다른 증상을 동반하는지 살펴보세요.,올바른 생활 습관이 도움이 될 거예요.,과도한 스트레스나 과로는 피하세요.,규칙적인 운동도 도움이 될 거예요.,장이 건강해야 몸이 건강하다는 말이 있어요. 몸이 보내는 신호를 살펴보세요.
머리가 아플 때가 있다.,어머..무슨 걱정 있으신가요? ,두통에는 다양한 원인이 있어요.,스트레스를 많이 받으시나봐요. ,고민거리가 많으신가 보네요. ,머리에 휴식 시간을 주세요.. ,두통을 가볍게 여기지 마세요.,함께 원인을 알아 봐요.,증상이 얼마나 자주 반복되는지 살펴 보세요.,얼마나 오랫동안 증상이 지속되는지 살펴보세요.,스트레스와 피로를 주의하세요.,정확한 원인 파악이 필요해 보여요.,잘못된 자세 등 나쁜 생활 습관을 갖고 계시진 않나요?,충분한 숙면도 도움이 될 거예요.,카페인은 줄이세요.
머리가 맑지 않다.,어머..무슨 걱정 있으신가요? ,그럴땐 명상이 도움이 되죠.,스트레스를 많이 받으시나봐요. ,잠깐 눈을 감고 명상을 해보세요.,머리에 휴식 시간을 주세요.. ,함께 원인을 알아 봐요.,잘못된 자세 등 나쁜 생활 습관을 갖고 계시진 않나요?,공기가 맑은 곳으로 함께 산책 갑시다.,주위 환기는 필수 입니다. ,충분한 숙면도 도움이 될 거예요.
자주 피곤한 편이다.,얼마나 무리를 하신 건가요.. ,걱정 되네요..너무 무리하지 마세요. ,가까운 거리로 산책을 나가보는 건 어떨까요?,오늘은 집에서 쉬시는게 좋을 거 같네요. ,가벼운 운동으로 몸에 활력을 주세요. ,잘 먹고 잘 자기. 기본적이지만 가장 어려운 것이죠. ,잘 쉬는 것만으로 삶의 질을 바꿀 수 있어요.,10분 정도 짧은 낮잠도 도움이 될 거예요.,키위와 수박은 피로 해소에 도움을 주는 과일이에요.,쉬는 게 나쁜 것만은 아니에요. 재충전의 시간이라고 생각해 보세요.,충분한 숙면을 취하고 계신가요?,그럴 수록 밖으로 나가 햇볕을 충분히 쬐세요. 행복호르몬인 세로토닌이 생성된다고 해요.
어지럼증을 느낀다.,많이 힘드시겠어요.,무리하지마세요..그러다 쓰러지시면 어떡해요.걱정되네요.,오늘은 집에서 쉬시는게 좋을 거 같네요. ,휴식이 필요해 보여요.,몸이 보내는 신호에 관심을 갖는 건 좋은 습관이에요.,무리한 다이어트 중이신가요?,어지럼증을 유발하는 원인은 여러가지라고 해요.,이럴 때일수록 끼니를 챙겨야 해요.,증상이 나타나는 시기와 빈도를 체크해 보세요.,다른 통증은 없는지 저와 함께 몸이 보내는 신호를 두루 살펴봅시다.,어지럼증에는 여러 가지 이유가 있어요. 원인을 알아내는 게 중요해요.,어지럼증을 흔한 증상이라고 대수롭게 여기지 마세요.,철분과 단백질을 충분히 섭취하세요.,구역감. 난청 등 어지럼증과 함께 찾아오는 증상이 무엇인지 체크해 보세요.
팔다리에 힘이 없다.,함께 원인을 알아 봐요.,어머..조금 쉬는게 좋을 거 같네요. ,너무 무리하지 마세요. ,음..걱정되네요..괜찮으신가요?  ,스쿼트. 런지. 가벼운 아령 들기처럼 팔다리 근육을 키우는 운동을 시작해 보세요.,기력에 도움이 되는 음식 정보를 찾아보세요. ,팔다리에 힘이 없으면 무기력하기 쉬워요.,스트레칭으로 몸을 깨워 보세요.,균형 잡힌 식사도 도움이 될 거예요.,다른 증상이 동반되는지 살펴 보세요.,저리거나 쥐가 나지 않는지 살펴 보세요.,음주는 피하세요.,증상이 한쪽 팔다리에만 나타나는지 살펴 보세요.,자신의 몸상태를 살펴 보는 건 중요합니다.,증상이 심하지 않다고 방치하지 마세요.
가래가 끓는다.,가래의 색깔은 어떤지 체크해 보세요.,가래가 생기는 이유에는 다양한 원인이 있어요.,먼지가 많은 곳은 피하세요.,배는 기관지에 좋은 과일이에요.,기관지 건강은 생활에 밀접한 영향을 줍니다.,수분을 충분히 공급해주세요.,미세먼지를 주의하세요.,흡연자는 담배를 줄이세요.,따뜻한 녹차를 마시는 것도 도움이 돼요.,방안의 습도를 조절해주세요.
목에 뭔가가 걸려서 뱉거나 삼키려고 해도 잘 안 된다.,다른 증상이 동반되는지 살펴 보세요.,에고 불편하시겠어요.,걱정되네요..괜찮으세요? ,자기 전 야식은 피하세요.,함께 정확한 원인을 찾아 봐요.,목에 이상이 있는지 확인해 봐야겠어요.,일상 생활에서 불편이 크시겠어요. ,해결방안을 고민해 볼게요. 
기침이 난다.,혹시...감기에 걸리신 건 아닌가요? ,다른 증상이 동반되는지 살펴보세요.,기침을 방치하지 마세요. 함께 원인을 알아 봐요.,아이고야..어떡해요..  ,기침 유발의 원인은 다양합니다. ,사소한 증상이어도 우습게 봐서는 안 돼요.  ,일상 생활을 방해하는 정도가 아니길 바라요.,굉장히 신경 쓰이시겠어요.,증상이 얼마나 지속됐는지 궁금해요.,먼지가 많은 곳은 피하세요.,잠자기 전 야식과 음주는 해로워요.,기침은 일상적인 증상으로 여기기 쉬워요. 몸이 보내는 신호를 자세히 살펴 보세요.
눈 밑이 검은 편이다.,아! 그러시군요.,많이 피곤하신 가봐요.. ,어머..걱정이 많으시겠어요. ,유전적인 원인도 있지만 후천적인 원인도 다양해요.,다크써클에 좋은 음식을 찾아보세요.,다크써클에는 연어가 좋다고 합니다. ,사람마다 발생 원인이 다르다고 해요. 함께 원인을 찾아 봐요. ,다크 써클은 안색을 어둡고 칙칙해 보이게 해요. 함께 정확한 원인을 찾아 보도록 해요.,눈 밑 피부는 다른 피부보다 얇아서 쉽게 자극을 받곤 해요. 함께 원인을 알아 봐요.,요즘 너무 피곤한 건 아닌가요? ,충분한 휴식을 취하고 계신가요?,다크써클에는 충분한 수면과 수분 섭취가 도움이 돼요.,비타민 C가 풍부한 음식은 피부를 밝고 건강하게 보이게 해요.
얼굴색이 누런 편이다.,어머..고민이 많으시겠네요.. ,비타민 C가 풍부한 음식은 피부를 밝고 건강하게 보이게 해요.,음..걱정되네요. ,양배추도 피부 미용에 좋은 효과를 준다고 해요.,언제부터 그러셨는지 궁금해졌어요. ,다른 증상이 동반되는지 함께 살펴볼까요.,증상을 조금 더 들어봐야겠어요. ,충분한 휴식을 취하고 계신가요?,안색이 좋지 않거나 얼굴빛이 달라진 건 몸이 보내는 이상 신호일 수 있어요.,충분한 휴식이 필요해 보여요.
몸에 말랑말랑한 멍울이 있다.,통증이 동반되지 않는지 살펴보세요.,충분한 휴식을 취하고 계신가요?,걱정되네요..괜찮으신거죠? ,잘 자고 잘 쉬는 것도 중요해요.,멍울이 만져져서 많이 놀라셨겠어요. ,멍울의 크기도 살펴 보세요.,별 일 아니었으면 좋겠어요. ,증상이 언제부터 시작됐는지 떠올려 보세요.,우리의 몸에 관심을 갖고 살펴보는 건 좋은 습관이에요.,다른 부위에는 멍울이 없는지 살펴보세요.
피부가 가렵다.,습한 환경은 가려움증을 악화시켜요.,원인이 많으니까 천천히 알아 보도록 해요.,가려움이 어느 부위에 나타나는지 살펴보세요.,인스턴트 식품은 멀리 하세요.,일상을 방해할 만큼의 가려움증이 아니길 바라요.,올바른 식이요법과 생활습관은 큰 도움이 될 거예요.,피부가 가려우면 신경이 곤두서기 쉬워요. ,가렵더라도 긁지 않도록 주의하세요.,평소 피부 보습에 신경쓰는 것은 좋은 습관이에요.,물을 자주 드시고 수분 함량이 높은 과일도 챙겨 드세요.,뜨거운 물로 장시간 씻는 건 좋지 않아요.,긁지 않도록 주의하세요. 2차 감염을 주의하셔야 해요.
대변이 묽고 끈끈한 편이다.,묽은 변에는 다양한 원인이 있어요. 함께 알아보도록 해요.,증상이 얼마나 지속되었는지 궁금해요.,걱정되네요.,다른 증상을 동반하는지 살펴 보세요.,대변의 특성은 섭취 식품에 따라 다를 수 있습니다.,통증은 없는지 궁금해요.,괜히 마음까지 불편하실 것 같아요. ,기름진 음식을 피하세요. 식습관 개선도 도움이 될 거예요.,변을 보는 횟수도 체크해 보세요.,요즘 스트레스를 많이 받고 계시진 않나요?
신물이 올라온다.,어머..괴로우시겠어요.. ,야식은 피하세요.,에휴..걱정되네요. ,아이고..힘드시겠어요.. ,신물이 올라올 때. 물을 충분히 마셔 주세요. ,식습관 분석도 필요해 보여요. ,신물에 의해 기관지가 상할 수 있어요.,잘 때 왼쪽으로 누워 자는 것도 도움이 될 거예요.,식습관 관리에 신경 쓰셔야 할 것 같아요.,다른 증상이 동반되는지 살펴 보세요.,음주와 카페인은 피하세요.,과도한 스트레스도 원인이 될 수 있어요.,기름진 음식을 피하세요.,과식을 주의하세요.,위장은 제 2의 뇌라고 해요. 그만큼 심리적인 영향을 많이 받는 장기예요. 주의를 기울이고 살펴 보세요.
트림을 자주 한다.,원인이 많으니까 천천히 우리 알아보도록 해요.,어머..괴로우시겠어요.. ,다른 증상이 동반되는지 살펴볼까요?,식습관 개선은 큰 도움이 될 거예요.,일상 생활에 지장이 없는 수준이길 바라요. ,신경이 많이 쓰이실 것 같아요. ,트림은 다양한 요인에 의해 발생할 수 있습니다. ,증상이 얼마나 지속되었는지 떠올려 보세요.,음식을 빨리 먹는 습관은 좋지 않아요.,가스를 유발하는 음식을 줄여 볼까요?
위가 아프다는 느낌이 든다.,너무 많이 드신건 아닌가요? ,요즘 스트레스를 받고 계신가요?,괜찮으세요?..걱정되네요.. ,충분한 휴식을 취하고 계신가요?,양배추는 위 건강에 좋은 음식이에요.,위에 부담을 주는 음식은 피하세요.,자극적인 음식은 피하세요.,따뜻한 매실차를 마셔보는 건 어떨까요?,커피와 술은 피하세요.,짜고 매운 음식은 좋지 않아요.,딱딱한 음식을 소화하기 어려워서 위에 부담을 줄 수 있어요.,걷기 운동과 요가도 도움이 될 거예요.,요가를 해보는 건 어떨까요? 위 건강에 도움이 되는 동작들이 있어요.
종종 배탈이 난다.,음식은 충분히 익혀 드세요.,요즘 스트레스를 받고 계신가요?,괜찮으세요?..걱정되네요.. ,요리를 할 때는 위생 관리에 각별한 주의가 필요해요.,배를 따뜻하게 하세요.,장이 예민하신 편인 것 같아요.,식단 관리를 시작하세요.,장에 무리가 가지 않는 음식을 택하세요.,꽉 조이는 옷이나 바지는 몸에 좋지 않아요.,따뜻한 매실차를 마셔보는 건 어떨까요?,짜고 매운 음식은 좋지 않아요.
식사 후 배가 더부룩하다.,너무 많이 드신건 아닌가요? ,딱딱한 음식을 소화하기 어려워서 위에 부담을 줄 수 있어요.,식사후에 30분 정도 산책을 같이 해봐요.,따뜻한 매실차를 마셔보는 건 어떨까요?,위에 부담을 주는 음식은 피하세요.,식사는 우리의 건강에 많은 영향을 줍니다.,과식은 건강에 좋지 않습니다.,지금은 위장 건강에 신경을 기울여야 해요. ,꽉 조이는 옷이나 바지는 몸에 좋지 않아요.,걷기 운동을 해보는 건 어떨까요?
명치끝을 눌렀을 때 아프다.,체한 건 아닌지 걱정이네요.,명치 통증에는 다양한 원인이 있어요. 함께 원인을 알아 보도록 해요.,음..걱정되네요.. ,다른 증상을 동반하는지 살펴 보세요.,위장 건강은 우리 생활에 많은 영향을 줍니다.,지금부터라도 위장 건강에 신경을 기울이세요.,통증이 심하지 않길 바라요. ,혹시 스트레스를 많이 받고 계신가요?,통증이 언제부터 나타났는지 떠올려 보세요.,카페인은 멀리 하세요.,식사 후 바로 눕는 습관을 피하세요.,규칙적인 생활이 중요해요.,잠들기 세 시간 전에는 음식물을 섭취하지 마세요.,배를 조이는 옷은 피하세요.
몸이 무거운 느낌이 든다.,무리하셨나보네요. ,에휴..요즘 너무 무리하신거 아니에요? ,충분히 휴식을 취하고 계신가요?,가벼운 운동을 시작해 보세요.,혹시 스트레스를 많이 받고 계신가요?,단백질로 구성된 아침 식사를 추천해요.,언제부터 그런 느낌을 받으셨는지 궁금해지네요.,잘 쉬고 잘 자는 게 중요해요.,따뜻한 물로 반신욕을 해보는 건 어떨까요? 몸의 긴장을 풀어 보세요.
체중이 점점 늘어난다.,잠을 충분히 주무시나요?,갑작스러운 체중 변화에는 여러 가지 원인이 있어요. 함께 알아보도록 해요.,고른 영양 섭취와 꾸준한 운동을 추천해요.,체중계가 고장난 건 아닐까요?,밤낮이 바뀐 생활을 하거나 스트레스를 많이 받고 계시지는 않나요?,아침에 일찍 일어나 햇볕을 쬐는 것도 도움이 될 거예요.,몸이 보내는 신호에 관심을 가지는 건 좋은 습관이에요.
몸이 잘 붓는다.,붓는 위치에 따라 원인도 다양해요.,너무 무리하지마세요. ,충분히 휴식을 취하고 계신가요?,가벼운 운동을 시작해 보세요.,과식은 피하세요.,통증을 동반하는지 살펴보세요.,몸이 보내는 신호에 관심을 가지는 건 좋은 습관이에요.,언제부터 증상이 나타났는지 떠올려 보세요.,다리가 붓는다면 잘 때 베개를 이용해 다리 위치를 심장보다 높게 하세요.,오래 앉거나 서지 말고 자주 몸을 움직여 주세요.,바른 자세를 유지해 보는 건 어떨까요?,요가와 플라테스 같은 운동도 도움이 될 거예요. 시간이 없다면 간단한 홈 트레이닝도 좋아요.,평소 따뜻한 물로 반신욕을 해보는 건 어떠세요?,포도는 노폐물 배출에 도움을 주는 과일이에요.
식사 후 피곤이 더 심해진다.,원인이 많으니까 천천히 우리 알아보도록 해요.,어머..괴로우시겠어요.. ,식후에 가벼운 산책이나 노래를 불러보세요.,저는 밥을 먹지도 않았는데 왜 이렇게 피곤할까요. ,몸에 부담이 가지 않는 음식을 택하세요. ,식사 직후 잠드는 것은 몸에 해롭습니다.,식사량 조절이 필요합니다. ,복숭아는 피로를 푸는 데 도움을 주는 과일이에요.
