질문, 맞장구(4~5점)
건망증이 있다.,메모하는 습관을 들여보세요. ,기운내세요..점차 좋아지실 거에요. ,걱정하지마세요..괜찮아지실 거에요. ,긍정적으로 생각하세요.,중요한 내용을 시야가 닿는 곳곳에 메모해 두세요. ,사실 저도 깜빡할 때가 있답니다. ,많은 사람들이 건망증을 지니고 있어요.,충분한 숙면도 도움이 된다고 해요.,엽산이 풍부한 푸른잎 채소를 자주 챙겨드세요.,우리의 머리도 충분한 휴식이 필요해요.,요즘 걱정이 많으신가요? 스트레스도 집중력과 기억력을 떨어뜨린다고 해요. ,기억력이 감소했다고 너무 부정적으로 생각할 필요는 없어요.,적절한 휴식이 필요해 보여요.,연어와 아보카도를 챙겨 드시는 것도 도움이 된다고 해요.,이럴 때일수록 긍정적으로 마음을 편히 가지세요.,충분한 휴식을 취하고 계신가요?,기억해야 할 일이 있다면 메모장이나 캘린더를 활용해 보세요.,
가족 간의 갈등이 있다.,가족들하고 진지하게 대화를 해보세요.,기운내세요..점차 좋아지실 거에요. ,걱정하지마세요..괜찮아지실 거에요. ,걱정이 많으시겠어요. ,마음이 힘드시겠어요.  ,그런 경우가 생각보다 많은 것 같아요. ,서로 비난하는 말은 대화와 소통을 단절시키고 서운한 마음을 커지게 해요.,부정적인 감정이 올라올 때 현명하게 스트레스를 푸는 것도 중요해요.,가족이 아니더라도 믿을 수 있는 다른 사람이 있다면 심리적으로 안정이 될 거예요.,대화의 방식을 바꿔보는 건 어떨까요?,이럴 때일수록 유머는 감정의 응어리를 순식간에 녹이는 좋은 해결책이기도 해요. ,바쁠 수록 서로의 힘든 점을 보듬어줄 여유가 없어지는 것 같아요.,배드민턴과 탁구 같은 운동은 가족 간에 친밀감을 형성하는 데 도움이 돼요.,서로의 입장에 서서 생각하는 시간이 필요해 보여요.,가족마저 나를 인정해주지 않는다는 건 너무 슬픈 일이에요.,가족 문제는 한 사람의 의지가 아닌. 가족 전체의 노력이 필요해요.,갈등을 완벽하게 해결해야 한다고 생각하기보다는. 지금 보다 좀 더 나은 관계를 만드는 것에 초점을 맞춰 보세요.,가족이라는 이름으로 서로 상처를 주는 건 너무 슬픈 일이에요.,가까운 사이일 수록 서로 다름을 인정해야 해요.,서로 상처 주는 일들이 많은가요? 이럴 때일수록 함께 해서 좋았던 기억을 떠올려 보는 건 어떨까요?,가족이더라도 서로에게 완벽할 수 없다는 사실을 인정해야 해요.
심장이 두근거린다.,어머..무리하시면 안되시겠어요. ,걱정되네요..괜찮으신거죠? ,오늘은 집에서 쉬시는게 좋을 거 같네요. ,걱정하지마세요..괜찮으실거에요. ,얼른 진정되시면 좋겠어요.,통증을 동반한 두근거림이 아니길 바라요.,설렘으로 인한 두근거림이길 바라요. ,커피를 줄이는 것도 도움이 된다고 해요.,가슴 두근거림에는 여러 가지 원인이 있어요.,통증의 유형과 빈도를 체크해 보세요.,적절한 휴식이 필요해 보여요.,카페인을 줄여 보는 건 어떨까요?,과음은 절대 금물이에요! 
불안할 때가 있다.,요즘 무슨 걱정있으세요? ,걱정되네요..괜찮으세요? ,너무 불안해하지마세요. ,다 잘될거에요..너무 걱정하지마세요. ,무리하지마세요. ,다들 저마다의 불안을 안고 사는 것 같아요. ,지금도 충분히 잘하고 계신 걸요. ,불안 또한 감정의 일부예요. 억지로 떼어내려고 하기 보다는 부정적인 감정도 제대로 마주하는 지혜가 필요해요.,무엇 때문에 불안함을 느끼고 있는지. 마음을 천천히 들여다 보는 건 어떨까요?,불안은 나를 위협하는 감정이 아니라. 보살펴야 하는 감정이라고 해요.,마음이 불안할 때는 몸을 써보세요.,불안은 결국 생존을 위한 반응이라고 해요. 불안감이 꼭 나쁜 것만은 아니에요.,어떤 일이 막막하게 여겨질 수록 쉽게 생각하는 편이 좋아요.,확실하지 않다는 게 나쁜 것만은 아니에요. 결과를 알 수 없는 데서 뜻하지 않은 행운이 찾아오기도 해요.,종종 불안은 우리를 움직이는 원동력이 될 때가 있어요.,한 심리학자가 말했어요. 당신이 가장 두려워하는 것을 찾아라. 진정한 성장은 그 순간부터 시작된다.
깜짝깜짝 잘 놀란다.,그럴떄가 있기는 한데 조금 걱정이 되네요. 힘내세요.,걱정되네요..괜찮으세요? ,심호흡을 같이 해봐요.,어머..저도 깜짝깜짝 잘 놀래요. ,저만 그러는 게 아니었군요.,저는 강심장이에요. ,그럴 수 있어요.,사실 놀람은 감정보다 반사작용에 가까워요. 나를 돕는 기능이라 생각해보는 건 어떨까요?,따뜻한 차를 마시거나 가벼운 산책으로 마음의 긴장을 풀어 주세요.
평소 근심 걱정이 많다.,감정과 나를 동일하게 여기지 마세요. 감정은 나 자신이 아니니까요.,무엇 때문에 근심하는 지 그 원인을 관찰해보세요.,걱정은 또다른 걱정을 불러오기도 해요.,감정에서 감각으로 주의를 돌려보는 건 어떨까요? 운동을 하는 거나 음악을 듣는 것처럼 오감을 활용해보세요.,긍정적으로 생각해보세요. ,저한테 다 얘기하시고 훌훌 털어버리세요.,무엇 때문에 걱정을 하고 계신가요? 그 이유를 좋고 나쁨으로 평가하지 않고 그대로 바라보세요.,생각을 비우는 연습도 필요해요. ,걱정마세요. 제가 있잖아요.,감정의 출처를 추적해 보세요.,감정을 객관적으로 바라보세요. 근심이 많을 수록 이성적인 판단이 사라지게 돼요.
추웠다 더웠다 한다.,몸에 어떤 변화가 일어나고 있는지 조금 더 같이 알아보죠.,몸의 보일러가 고장났나봐요. ,날씨 때문이면 다행인데 아니라면 제가 좀 더 질문을 할게요.,감기에 걸릴지도 모르니 조심하세요.,휙휙 바뀌는 몸의 변화에 많이 당황스럽겠어요.,몸의 변화에 기분까지 예민해질 수 있어요.,저런. 속상하시겠어요. 몸의 온도계가 말을 듣지 않는군요.,추울 때는 모자를 써서 머리를 따뜻하게 하세요. 머리는 몸에서 열이 가장 많이 빠져나가는 부위라고 해요.
가슴이 조이는 느낌이 있다.,요새 걱정이 너무 많으신거 아니에요? ,혹시..답답한 일이 있으세요? ,너무 무리하지 마세요. ,걱정되네요..괜찮으신거죠? ,집에서 좀 쉬셔야 할 것 같아요. ,술. 담배는 피하세요.,스트레스가 많으신가요?,따뜻한 차를 한 잔 마셔 보는 건 어떨까요?,증상의 주기를 체크해 보세요.,내 몸이 어떤 신호를 보내고 있는지 주의를 기울여 보세요.,몸의 증상에 관심을 가지는 건 좋은 습관이에요.
입맛은 있으나 소화가 안된다.,부드러운 음식을 드셔보는 건 어떨까요?,무슨 일 있으신가요? ,양배추를 자주 섭취하세요. 위벽을 보호하는 효과가 있다고 해요.,커피와 튀긴 음식. 매운 음식은 피하세요.,신맛이 강한 과일은 위에 자극이 되니 피하세요.,따뜻한 차는 속을 편안하게 하고 몸을 이완키키는 데 도움이 될 거예요.,섬유질이 풍부한 음식은 소화에 도움이 돼요.,천천히 소량을 드셔 보는 건 어떨까요?,그렇다고 끼니를 거르시면 안 돼요.,부담이 적은 음식을 드셨으면 해요.,소화가 안 되는 이유에는 여러 가지 원인이 있어요.
어지럽다.,허어 그것 참 …걱정이에요.,무리하지 마세요.,오늘은 집에서 쉬는게 좋을 거 같네요. ,이런 날은 충분히 휴식을 취해야 해요.,그러고보니 저도 머리가 아픈거 같네요. ,휴식이 필요해 보여요.,혹시 다이어트 중이신가요?,몸이 보내는 신호에 관심을 갖는 건 좋은 습관이에요. ,증상이 나타나는 시기와 빈도를 체크해 보세요.,다른 통증은 없는지 저와 함께 몸이 보내는 신호를 두루 살펴봅시다.,어지럼증에는 여러 가지 이유가 있어요. 원인을 알아내는 게 중요해요.,어지럼증을 흔한 증상이라고 대수롭게 여기지 마세요.,철분과 단백질을 충분히 섭취하세요.,구역감. 난청 등 어지럼증과 함께 찾아오는 증상이 무엇인지 체크해 보세요.
가슴이 아프다.,어머..괜찮으신거죠? ,음..걱정되네요..무리하지마세요. ,요새 너무 무리하신거 아니에요? ,에구머니나... ,가슴 통증에는 여러 유형이 있어요. 증상이 어떻게 나타나는지 살펴보세요.,도움을 드리지 못해서 저도 가슴이 아파요. ,큰 문제가 아니었으면 좋겠어요. ,제가 도움을 드릴 수 있으면 좋겠어요. ,찌릿한지. 화끈거리는지 증상을 체크해보세요.,가슴 통증이 얼마나 자주 느껴지는지 살펴보세요.,같이 원인을 알아봐요.
한숨을 쉰다.,아이고. 그러다 땅이 꺼지겠어요. ,땅이 꺼져라 한숨지시면 저는 어찌해야 될까요.. ,에휴..저도 덩달아 한숨이 나오네요. ,요새 많이 힘드신가봐요. , 요즘 고민이 많으신가 보네요. ,앞으로는 웃을 일만 있으시길 바라요. ,제가 걱정을 덜어드리고 싶어요.,말하기 어려운 일이 있으신가요? 제가 들어드릴게요.,천천히 숨을 크게 들이쉬고 길게 내쉬는 심호흡을 반복해보세요. 도움이 될 거예요.,긴장을 하면 한숨을 많이 쉬게 돼요. 몸을 움직여 보는 건 어떨까요?,호흡이 부드럽고 규칙적으로 이어져야 마음도 안정 돼요.,스트레스를 많이 받고 계신가 봐요.,답답한 일을 겪고 계신가요?,한숨이 나쁜 것만은 아니에요. 깊은 숨은 온몸 구석구석으로 산소를 공급하니까요. 다만 뭐든 지나치면 좋지 않아요.
가슴이 답답하다.,무슨 속상한 일 있으세요?.. ,어머..괜찮으신거죠? ,음..걱정되네요..무리하지마세요. ,요새 너무 무리하신거 아니에요? ,속상하네요..무슨일인지 모르겠지만 힘내세요. ,밖에 나가서 산책 한번 해보세요. ,같이 바람 쐬러 나갈까요?,좋은 날이 곧 올 거예요. ,도움을 드리지 못해 저도 답답하네요. ,스트레스를 많이 받고 계신가요?,너무 꽉 끼는 옷은 피하세요.,이럴 때일 수록 숨을 크게 들이쉬고 길게 내쉬는 심호흡에 집중해 보세요.,수시로 걷거나 스트레칭을 하는 것도 좋은 방법이에요.
늘 피곤하여 눕고만 싶다.,저런…요즘 무리하신건가요?,이럴 때일 수록 실내에 있기 보다는 바깥에 나가 바람을 쐬는 건 어떨까요?,가까운 거리로 산책을 나가보는 건 어떨까요?,쉬는 게 나쁜 것만은 아니에요. 재충전의 시간이라고 생각해 보세요.,팔과 어깨. 몸을 가볍게 움직이고 풀어 보세요.,아보카도와 바나나는 기분이 좋아지는 데 도움이 되는 음식이라고 해요.,오늘부터 꾸준히 운동을 해 보세요.,하루 정도 푹 자고. 푹 쉬어 보면 어떨까요?,충분한 숙면을 취하고 계신가요?,그럴 수록 밖으로 나가 햇볕을 충분히 쬐세요. 행복호르몬인 세로토닌이 생성된다고 해요.
기분이 가라앉거나 사는 게 재미없다.,어머..왜 그렇게 되셨나요.. ,그렇다고 집에만 계시면 안 돼요. ,밖에 나가서 바람 좀 쐬고 오세요. ,산책이라도 다녀오세요. ,저런. 훌훌 털어버리시면 좋은텐데요.,아..갑자기 무슨 일이 있었던거죠? ,날씨가 사람의 기분을 많이 좌우한다고 해요.,사는 게 항상 재밌을 수는 없는 것 같아요. ,제가 말동무가 되어 드릴게요. ,부정적인 생각이 들 때는 잠시 머리를 쉬게 하세요. 생각의 스위치를 끄는 거예요.,동전에 양면이 있듯 마음에도 우울한 감정이 있을 수 있어요.,햇볕을 충분히 쬐세요. 행복호르몬인 세로토닌이 생성된다고 해요.,겨울이 가면 봄이 오듯이 좋은 날이 올 거예요.
잠자는 동안 땀이 난다.,혹시..악몽을 꾸신건 아니죠? ,몸의 보일러가 고장났나봐요. ,매운 음식은 피하는 게 좋아요.,몸이 많이 안 좋으신가봐요..  ,앞으로는 편히 주무시길 바랄게요. ,마음의 부담을 내려 놓으시면 좋겠어요.,자는 동안 땀이 나는 이유를 알아볼게요.,생야채나 익힌 나물을 자주 섭취하세요.,땀띠가 생기지 않도록 통풍이 잘 되는 옷을 입으시는 게 좋아요.,잠들기 전 환기를 통해 공기를 신선하게 하세요.
불면증이 있다.,낮 시간에 규칙적인 운동을 해보는 건 어떨까요?,그렇다고 자기전에 폰 만지시면 안 돼요.. ,음..걱정되네요.. ,하루 종일 피곤하시겠어요. ,과도한 카페인은 수면을 방해해요.,자기 전에 따뜻한 물로 샤워를 해보세요. 몸을 이완시켜줄 거예요.,따뜻한 우유 한 잔 어떠세요?,모두가 잠든 밤. 나만 잠이 들지 않는다는 건 괴로운 일이에요.,요즘 걱정이 많으신가요?,불면증은 의식하면 할 수록 더욱 심해진다고 해요. 빨리 잠들어야 한다는 강박은 오히려 좋지 않아요.,쉽게 잠들지 못 하는 이유를 찾아보는 건 어떨까요? 긴장이나 불안. 소음. 잠자리 변화 등 여러 가지 이유가 있어요.,바나나는 불면증에 효과적인 과일이에요.,잠들지 못할 때. 잠시 앉아서 생각을 정리하는 것도 좋은 방법이에요.,저녁 시간에는 커피를 멀리 하세요.,잠들기 한 시간 전 따뜻한 목욕물에 몸을 담가 보세요. 낮 동안 쌓였던 긴장을 풀어줄 거예요.,방안을 어둡게 하세요. 밝은 조명은 잠드는 데 방해가 될 거예요.,도무지 잠이 오지 않는다면 책을 읽거나 차분한 음악을 들어 보세요.,같은 시간에 자고. 같은 시간에 일어나는 생활 리듬은 숙면에 도움이 돼요.
분노의 마음이 들 때가 있다.,천천히 호흡을 가다듬어 보세요. 산소가 결핍되면 이성적인 판단이 사라지게 돼요.,그래도 저를 때리진 말아주세요.. ,마음에도 온도계가 있어요. 감정의 변화가 나쁜 것만은 아니에요.,분노의 감정과 자신을 동일시하지 마세요. 감정이 곧 나인 것은 아니니까요.,무엇 때문에 화가 나나요? 그 이유를 좋고 나쁨으로 평가하지 않고 그대로 바라보세요.,우리 그럴땐 심호흡을 일분만 해봐요.,분노의 원인이 무엇인지가 중요해요.,분노 또한 자연스러운 감정의 일부라고 생각해요. ,저도 가끔은 그래요.,분노의 감정을 너무 나쁘게 생각하지 마세요. 항상 좋은 감정만 가질 수 있는 건 아니니까요.
감기가 자주 걸린다.,체온 관리를 잘 해주는 것도 중요해요.,영양 섭취에 신경쓰세요.,무엇보다 잘 쉬고. 잘 자는 게 중요해요.,스트레스를 받거나 너무 피곤한 건 아닌가요?,푹 쉬면서 따뜻한 생강차 한잔 어때요?,함께 면역력을 키워 봐요.,몸이 보내는 신호를 잘 살펴 보세요.,감기 예방에 손을 씻는 습관이 도움이 된대요.,물을 자주 마시는 것도 도움이 될 거예요.,충분한 휴식과 운동을 병행하세요.,요즘 잠이 부족한 건 아닌가요?,실내에만 있는 건 건강에 좋지 않아요. 산책이 도움 될 거예요.,스트레스를 많이 받으면 감기에 걸리기 쉽다고 해요.
감기가 오랫동안 낫지 않는다.,체온 관리를 잘 해주는 것도 중요해요.,아..면역력이 많이 약하신가봐요.. ,영양 섭취에 신경 쓰세요.,스트레스를 받거나 너무 피곤한 건 아닌가요?,무엇보다 잘 쉬고. 잘 자는 게 중요해요.,몸이 보내는 신호를 잘 살펴 보세요.,면역력을 높여야 해요. ,비타민이 많은 과일이 도움이 될 거예요.,요즘 잠이 부족한 건 아닌가요?,면역력이 떨어지면 감기가 금세 걸리고 잘 낫지 않아요.,따뜻한 물을 자주 드시는 것도 좋은 방법이에요.
말을 많이 하면 힘들어서 목소리가 작아진다.,허걱..얼마나 말을 많이 하신 건가요. ,모과차와 귤피차를 추천해요.,목은 면역계의 입구라고 해요. 피로가 쌓인 건 아닐까요?,성대도 휴식이 필요해요. ,목을 따뜻하게 해주세요. 손수건이나 목도리로 감싸는 것도 좋은 방법이에요.,오늘 하루도 고생하셨을 것 같아요. ,대추차는 목에 좋다고 해요. 면역력을 증가시키고 피로 회복에 도움이 될 거예요.,목이 건조해지지 않게 따뜻한 물을 자주 드세요.,무리하고 계신가요? 몸의 면역이 떨어지고 피로를 느낄 때 가장 먼저 무리가 가는 곳이 목이에요.,도라지차와 생강차도 목 건강에 도움이 됩니다.,자극적인 음식은 피하세요.
체력에 비해 일을 무리하게 많이 한다.,허걱..얼마나 일을 많이 하신 건가요. ,몸과 마음이 리듬을 잃으면 방전되는 법이에요.,무리하지 마세요. 쉬어가는 시간도 중요해요.,걱정되네요..괜찮으세요? ,음..걱정되네요..무리하지마세요. ,건강하지 않으면 일도 할 수 없다는 걸 유념하세요.,체력을 기르기 위해서는 운동을 하셔야 해요.,꾸준한 운동은 체력을 향상시켜요. ,휴대폰에도 충전이 필요하듯이 우리의 몸과 마음에도 재충전의 시간이 필요해요.,가끔은 삶의 속도를 줄이고 잠시 쉬어갈 필요가 있어요.,한번씩 멈춰 서서 나아가야 할 방향을 점검해 보는 건 어떨까요?,몸이 지쳤다는 신호를 보내고 있지는 않나요?,건강한 몸이 건강한 생각을 가져옵니다. 몸 관리에 소홀히 하면 안 돼요.,햇빛을 받으며 산책하는 시간을 가지세요.,잘 쉬고 잘 자는 것도 중요해요.,재충전하는 시간을 갖는 것도 중요해요.,업무 시간과 쉬는 시간을 분리하세요. ,일을 하지 않으면 불안한 마음이 드나요? 아무 것도 하지 않는 것에도 연습이 필요해요.,쉼의 중요성을 잊지 마세요.
일하는데 스트레스를 많이 받는다.,허걱..얼마나 일을 많이 하신 건가요. ,너무 무리하지 마세요.,걱정되네요..괜찮으세요? ,음..걱정되네요..무리하지마세요. ,기분 전환이 필요해 보여요. 가까운 곳으로 여행을 가는 건 어떨까요?,기분 전환이 필요해 보여요. 좋아하는 음악을 듣는 건 어떨까요?,충분한 휴식이 필요해 보여요.,스트레스를 관리하는 방법이 중요해요.,스트레스가 줄어든다면 일의 효율도 높아질 거예요.,업무 시간과 쉬는 시간을 분리하세요. 쉴 때 즐길 수 있는 취미나 여가 활동은 어떠세요?,직장 스트레스. 방치하면 안 돼요.,직장 스트레스는 가볍게 볼 문제가 아니에요. 번아웃을 주의하세요.,때로는 가족이나 친구에게 고민을 털어놓는 것도 큰 위로가 돼요.,한국인이 스트레스를 가장 많이 받는 공간이 직장이라고 해요. 일하는 공간과 휴식 공간을 분리하세요.
일하는 시간이 불규칙하다.,아이고...힘드시겠네요.. ,항상 피곤하시겠어요.. ,너무 무리하지마세요. ,업무 시간과 쉬는 시간을 분리하세요.,재충전하는 시간을 갖는 것도 중요해요.,그럴수록 건강에 신경을 써야 해요.,그렇다고 끼니까지 거르시면 안 돼요. ,업무 스트레스도 많으실 것 같아요. ,몸이 지쳤다는 신호를 보내고 있지는 않나요?,건강한 몸이 건강한 생각을 가져옵니다. 몸 관리에 소홀히 하면 안 돼요.잘 쉬고 잘 자는 것도 중요해요.,식사는 잘 챙겨 드시나요? 불규칙한 식사는 건강에 해로워요.,모든 일에는 균형이 필요해요. 삶의 균형이 무너지지 않게 주의하세요. 
입맛이 없다.,그럴 수록 좋은 사람들과 함께 하는 시간을 늘려보세요.,정말인가요?? 무슨 일 있으신가요? ,입맛이 없을 때는 조금씩 자주 먹는 것이 좋아요. ,아..그러시군요... ,에구머니나 ,입맛이 없을 때는 비타민과 미네랄이 풍부한 채소와 과일을 섭취하세요.,입맛을 돋워주는 오미자차나 매실차를 추천해요.,입맛이 없다고 하시니 걱정입니다. ,저도 그럴 때가 있어요. 입맛을 돋워주는 음식을 찾아보는 건 어떨까요?,간단하게라도 드셔야 해요. ,끼니를 거르기 보다는 죽 같이 부담 없는 음식을 드셔 보세요.,운동을 하는 것도 도움이 될 거예요.,입맛이 없을 때는 조금씩 자주 드시면서 천천히 양을 늘리세요.
소화가 잘 안된다.,어머..걱정이네요.,차거나 자극적인 음식은 피하세요.,가만히 있기 보다는 몸을 움직여 보세요.,소화 불량에는 여러 가지 원인이 있어요.,소화불량과 동반되는 증상을 살펴 보세요.,속이 더부룩하고 소화가 안 될 때 탄산음료를 찾는 건 좋지 않아요.,카페인은 피하세요.,배는 소화를 돕는 효소가 풍부한 과일이에요.
평소 팔다리가 무겁고 힘이 없다.,스쿼트. 런지. 가벼운 아령 들기처럼 팔다리 근육을 키우는 운동을 시작해 보세요.,운동을 조금 해보는건 어떨까요? ,기운 나게 간단한 스트레칭을 해보시면 어떨까요? ,너무 무리하지 마세요. ,음..걱정되네요..괜찮으신가요? ,너무 걱정 마세요. 개선할 방법이 있을 거예요.,언제부터 증상이 나타났는지 떠올려보세요.,균형 잡힌 식사도 도움이 될 거예요.
오래 서 있거나 걷기가 힘들다.,저와 같이 원인을 알아 봐요.,불편함이나 통증이 있다면 절대 무리하지 마세요.,그렇다면 너무 무리하지 마세요. ,음..걱정되네요..괜찮으신가요? ,통증을 느끼는 자세는 자제하세요.,부담이 되지 않는 선에서 근력을 강화하는 운동을 꾸준히 해봐요.,전보다 체력이 떨어지셨나봐요. ,오래 서있어야 할 때는 발목을 자주 움직여주세요.,쉴 때 다리를 베개 위에 올려 혈액순환을 돕는 것도 좋은 방법이에요.
식사를 거르면 힘이 쭉 빠진다.,외출할 때 간식을 챙겨 나가세요.,밥이 보약이라는 말이 괜히 있는 게 아닌 걸요.,몸이 보내는 신호에 주의를 기울이세요.,음..걱정되네요..괜찮으신가요? ,바쁘거나 입맛이 없을 때에는 간단한 선식이나 죽을 챙겨 먹는 것도 좋은 방법이에요.,규칙적으로 식사하는 습관을 들이세요. ,끼니를 거르면 몸에 부담이 가요. ,이제부터는 끼니를 꼭 챙기세요. 
식사 후에 몸이 나른하고 피곤하다.,체력이 떨어지면 쉽게 나른해진다고 해요.,식사 후에 간단한 산책을 해보는 건 어떨까요?,너무 졸릴 때에는 10분 정도 짧은 수면을 취하는 것도 좋아요.,아침 식사를 하고 계신가요? 아침을 거르면 점심에 폭식을 과식을 해서 나른함이 심해질 수 있어요.,적당량을 섭취하는 것도 방법이에요. ,비타민. 무기질이 풍부한 식품을 섭취하세요.,식사 후에 야외 활동을 해보세요. 
일 하고나면 몸이 아프다.,얼마나 무리를 하신 건가요.. ,걱정 되네요..너무 무리하지 마세요. ,무리하고 계신가요? 뭐든 과하면 좋지 않은 법이에요.,무리하지 마세요. 쉬어가는 시간도 중요해요.,너무 많은 신경을 쏟은 탓이예요. ,열심히 일한만큼. 충분히 쉬어주세요. ,오늘도 고생 많으셨어요. 이제 쉬세요. ,몸이 지쳤다는 신호를 보내고 있는 게 아닐까요?,모든 일에는 균형이 필요해요. 삶의 균형이 무너지지 않게 주의하세요.
몸이 항상 피곤하고 나른하다.,얼마나 무리를 하신 건가요.. ,걱정 되네요..너무 무리하지 마세요. ,힘든 운동을 시작하기 보다는 규칙적으로 산책을 해보는 건 어떨까요?,오늘은 집에서 쉬시는게 좋을 거 같네요. ,얼른 활력을 찾으셨으면 좋겠어요. ,피로는 사람을 지치게 해요. ,쉬운 운동부터 시작해보셨으면 좋겠어요. ,체력이 떨어지면 쉽게 나른해진다고 해요.,몸이 보내는 신호에 주의를 기울이세요.,바쁘시더라도 끼니는 꼭 챙기세요.,피로가 쌓이셨군요. 따뜻한 물로 반신욕을 해보는 건 어떨까요?,너무 피곤할 때는 낮잠을 자는 것도 도움이 돼요.,평소에 잠은 충분히 주무시는지 걱정이 드네요.,일을 할 때 속도를 조절하세요. 너무 빨리 하려고 하거나 몰아서 하지 마세요. ,일을 하는 동안에도 짧은 휴식을 취하세요.
