질문, 맞장구(4~5점)
식사 후 바로 배가 아프다.,원인이 많으니까 천천히 우리 알아보도록 해요.,어머..괴로우시겠어요.. ,딱딱한 음식을 소화하기 어려워서 위에 부담을 줄 수 있어요.,위장에 부담을 주어서는 안 됩니다. ,식단 관리에 신경쓰세요.,자극적인 식단은 몸에 좋지 않습니다.,꽉 조이는 옷이나 바지는 몸에 좋지 않아요.,위에 부담을 주는 음식은 피하세요.,음식을 지나치게 빨리 드시지는 않나요?,배를 따뜻하게 하세요.,맵고 짠 음식은 피하세요.
식사 후 바로 대변을 본다.,원인이 많으니까 천천히 우리 알아보도록 해요.,어머..괴로우시겠어요.. ,외출 할 때 얼마나 불편하시겠어요.,탈수 하지 않도록 물을 충분히 마시세요.,불편한 부분이 정말 많을 것 같아요. ,장 건강에 유의할 필요가 있습니다. ,밀가루와 인스턴트 음식을 줄이는 것도 방법이에요.,기름진 음식을 피하세요.,불규칙한 식사 습관을 갖고 계시진 않나요?,요즘 스트레스를 많이 받고 계시지는 않나요?,몸에서 보내는 신호에 주의를 기울이세요.,따뜻한 물로 좌욕을 꾸준히 하세요. ,과식을 피하세요.,통증이 나타나지 않는지 살펴 보세요.,기름진 음식과 육류. 유제품을 줄이세요.,운동을 병행하는 것도 도움이 될 거예요.
다른 지역에 가서 물갈이 하면 복통과 설사를 한다.,어머..여행가시면 힘드시겠어요. ,아..많이 불편하시겠어요. ,낯선 지역에 방문했을 때는 수돗물을 마시지 않는 게 좋아요.,물을 끓여 드세요.,수돗물 대신 생수를 사서 마시는 게 좋아요.,길거리에서 파는 음료수와 과일도 주의하세요.,물갈이 증상이 나타날 때는 탈수 증상을 주의하세요. 이온음료나 소금물을 충분히 섭취하는 것도 좋은 방법입니다.,지사제를 복용해 인위적으로 설사를 멎게 하는 건 오히려 병을 키울 수 있어요.,수돗물이나 길거리 음식은 피하세요.,손을 자주 씻는 것도 중요해요.,예방이 가장 중요해요. 음식을 잘 익히고 물도 반드시 끓여 드세요.
특정 음식에 두드러기가 난 적이 있다.,어머..힘드시겠어요. ,아..많이 불편하시겠어요. ,많이 괴로우시겠네요. ,아이고..신경 많이 쓰셔야 겠네요. ,특정 음식을 피하세요. ,몸이 보내는 신호에 주의를 기울이세요.,음식을 먹을 때 신경을 기울이세요. ,가려워도 긁지 마세요. 2차 감염을 주의하셔야 해요.,내 몸에 맞지 않는 음식은 피하세요.,음식점에 갔을 때에는 어떤 재료가 사용되었는지 메뉴판을 살펴 보세요.
평소 대변이 묽은 편에 속한다.,어머..힘드시겠어요. ,아..많이 불편하시겠어요. ,많이 괴로우시겠네요. ,아이고..신경 많이 쓰셔야 겠네요. ,대변은 섭취 음식에 따라 특성이 다를 수 있습니다.,괜찮아요. 원인을 찾으면 방법도 보이거든요.,음식 섭취에 유의하세요. ,묽은 변에는 다양한 원인이 있어요. 함께 알아보도록 해요.,증상이 얼마나 지속되었는지 궁금해요.,다른 증상을 동반하는지 살펴 보세요.,요즘 스트레스를 많이 받고 계시진 않나요?,기름진 음식을 피하세요. 식습관 개선도 도움이 될 거예요.,변을 보는 횟수도 체크해 보세요.
소변을 자주 본다.,소변 색깔은 어떤지 체크해 보세요.,아..불편하시겠어요. ,에구머니나..힘드시겠어요. ,어딜 가든 화장실을 찾아 놓으셔야 겠네요. ,소변은 우리 몸의 상태를 점검하는 중요한 지표예요.,일상생활에 불편함이 크시겠어요.,무엇 때문인지 궁리해 볼게요.,하루에 몇 회 정도 소변을 보는지 세어보세요.,혹시 스트레스를 많이 받고 계신가요?,커피와 녹차는 멀리 하세요.,술을 멀리 하세요.,통증이 느껴지진 않는지 궁금해요.,탈수 현상에 주의하세요.
팔다리에 관절통이 있다.,요새 무리하셨나보네요. ,너무 무리하지마세요. ,관절에 스트레스를 주는 반복적인 동작을 주의하세요.,찬바람에 유의하세요. 몸의 근육을 수축시켜서 통증을 심하게 해요.,몸이 보내는 신호를 무시하거나 참지 마세요.,관절 건강에 소홀해서는 안됩니다. ,무리한 동작을 취하지 마세요. ,관절에 부담이 가는 운동을 하지 마세요.
관절에 통증이 있다.,몸이 보내는 신호를 무시하거나 참지 마세요.,너무 무리하지마세요. ,에구. 힘드시겠어요.,관절에 스트레스를 주는 반복적인 동작을 주의하세요.,무리해서 걷거나 계단을 오르지 마세요.,통증이 심하지 않았으면 좋겠어요. ,일상생활에 불편함이 크시겠어요.,관절통을 일으키는 다양한 원인이 있어요. 함께 알아보도록 해요.,관절 관리에 더욱 신경을 기울이셔야겠어요.,무리가 되지 않는 선에서 근육을 풀어주는 스트레칭은 도움이 될 거예요.온찜질도 도움이 될 거예요.
야간에 쑤시고 아파서 잠자기 힘들다.,적절한 휴식을 취하고 계신가요?,충분하 휴식이 필요해 보여요.,너무 무리하지 마세요. ,불편함이 크시겠어요.,통증의 원인을 함께 찾아보도록 해요.,제대로 수면을 취하지 못하면 온종일 괴로워요. ,잠이 보약인데 정말 속상하네요.,제대로 휴식을 취하지 못 하면 더욱 통증이 심해질 텐데요. 걱정이네요.,관절은 습도의 영향을 받아요. 실내온도와 습도 등 주위 환경을 적절히 조절해주세요.
옆구리가 아프다.,원인을 같이 알아보도록 해요.,너무 무리하지 마세요.,괜찮으세요?? 걱정되네요.. ,불편함이 크시겠어요.,충분한 휴식이 필요해 보여요.,통증을 견뎌서는 안됩니다. ,몸이 보내는 신호를 무시하거나 참지 마세요.,함께 방법을 찾아보도록 해요. ,함께 원인은 살펴볼까요?,통증을 느낄 때에는 충분히 휴식을 취하세요.,통증의 정도가 궁금해지네요.,통증을 자주 느끼시는 건 아닌지 걱정돼요.,구부정한 자세는 증상을 악화시켜요.,온찜질도 도움이 될 거예요.
아랫배가 아프다.,원인을 같이 알아보도록 해요.,너무 무리하지 마세요.,괜찮으세요?? 걱정되네요.. ,불편함이 크시겠어요.,충분한 휴식이 필요해 보여요.,배를 따뜻하게 하세요.,몸이 보내는 신호를 무시하거나 참지 마세요.,함께 방법을 찾아보도록 해요. ,함께 원인은 살펴볼까요?,통증을 느낄 때에는 충분히 휴식을 취하세요.,통증의 정도가 궁금해지네요.,통증을 자주 느끼시는 건 아닌지 걱정돼요.,다른 통증이 동반되는지 살펴 보세요.
일정 부위의 저림 증상이 오래도록 낫지 않는다.,아이고야..걱정되네요.. ,에휴..그러시군요. ,아...많이 괴로우시겠어요. ,많이 불편하시겠어요.. ,충분한 휴식이 필요해 보여요.,몸이 보내는 신호를 무시하거나 참지 마세요.,증상에 대해 자세히 알고 싶어요. ,찬바람에 유의하세요. 몸의 근육을 수축시켜서 통증을 심하게 해요.,함께 원인은 살펴볼까요?,함께 방법을 찾아보도록 해요. ,어느 부위에 증상이 나타나는지 살펴 보세요.,단순한 저림 증상이라고 대수롭게 여기시면 안 돼요.,다른 통증이 동반되는지 살펴 보세요.
멍이 잘 든다.,아이고야..조심하셔야 겠어요. ,부딪치지 않게 조심하세요. ,멍이 유난히 오랫동안 지속되지는 않는지 살펴보세요.,에고..어딘가 부딪치지 않게 조심해 보세요.,멍이 잘 드는 이유는 다양하다고 해요. ,멍든 직후 온찜질을 바로 하는 건 피하세요. 멍든 후 바로 압박을 가하면 오히려 크게 번질 수 있어요.,작은 증상이라고 쉽게 여겨서는 안 됩니다.,균형 잡힌 식습관도 도움이 될 거예요.,비타민 K는 멍을 예방하는 데 도움이 돼요. 케일. 브로콜리. 시금치 같은 채소에 많이 들어 있어요.,처음에는 온찜질이 아닌 냉찜질을 해주세요. 온찜질은 멍든 지 1~2일 정도가 지나고 하세요.,유산소 운동은 혈관 건강에 도움이 됩니다.,견과류는 혈관을 튼튼하게 하는 데 도움이 돼요.
복부에 덩어리가 느껴진다.,아이고야..걱정되네요.. ,눌렀을 때 덩어리가 단단한지 확인해 보세요.,덩어리가 만져지는 위치를 살펴 보세요.,규칙적인 식사와 스트레스 관리에 유의하세요.,덩어리가 크지 않으면 좋겠어요. ,많이 놀라셨겠어요.,덩어리가 만져지는 위치가 바뀌는지 살펴보세요.,다른 통증을 동반하는지 살펴 보세요.,몸이 보내는 신호를 무시하거나 참지 마세요.
눈 밑이 푸르거나 자주색을 띄며 어둡다.,비타민 C가 풍부한 음식은 피부를 밝고 건강하게 보이게 해요.,눈 밑 피부는 다른 피부보다 얇아서 쉽게 자극을 받곤 해요. 함께 원인을 알아 봐요.,어머..걱정이 많으시겠어요. ,신경 쓰이시겠어요. 함께 정확한 원인을 찾아 보도록 해요.,유전적인 원인도 있지만 후천적인 원인도 다양해요.,고민이 크시겠어요. 눈 밑 다크서클은 얼굴 전체의 인상을 좌우하니까요.,눈 밑 피부는 다른 피부보다 얇아요. 눈가 피부의 보습에도 신경을 기울여 보세요.,충분히 휴식을 취하고 계신가요?,다크서클에는 여러 가지 원인이 있어요. 함께 원인을 찾아 봐요.,양배추는 붉은 다크서클을 없애는 데 도움이 돼요.,브로콜리는 다크서클을 개선하는 데 도움이 돼요.
입술이나 혀의 잇몸의 색이 푸르거나 자주색을 띄며 어둡다.,몸이 보내는 신호에 관심을 갖는 건 좋은 습관이에요.,충분한 휴식을 취하고 계신가요?,어머..걱정이 많으시겠어요. ,입술을 보면 건강이 보인다는 말이 있어요. 저와 함께 잘 살펴 보도록 해요.,고민이 크시겠어요. 함께 원인을 알아보도록 해요.,함께 원인은 살펴볼까요?,동반되는 증상이 있다면 상세히 알려주세요. 
대변색이 검다.,많이 놀라셨겠어요.,복용 중인 약이 있는지 떠올려 보세요.,대변 색깔은 우리 몸의 건강을 나타내는 대표적인 신호예요.,많이 놀라셨죠? 함께 원인을 알아보도록 해요.,철분제를 복용하고 계시진 않나요?,다른 증상이 동반되는지 함께 살펴볼까요.,음식 또한 대변 색에 영향을 미칠 수 있어요. 함께 원인을 알아보도록 해요.,대변 색을 관찰하는 것은 중요한 습관이에요.
최근 넘어지거나 교통사고 등 심하게 부딪힌 후 증상이 있다.,몸이 보내는 신호를 무시하거나 참지 마세요.,통증을 방치하지 마세요. 자칫하면 더 큰 증상으로 발전할 수 있어요.,다른 증상이 동반되는지 살펴볼까요?,후유증은 사고 직후보다 어느 정도 시간이 흐른 뒤에 나타나는 법이에요.,많이 놀라셨겠어요.,부기나 통증이 있는지 잘 살펴 보세요.,대부분의 교통사고는 후유증을 동반하죠. ,당장 괜찮다고 해서 안심하면 안 돼요. 
발목이나 손목 또는 허리가 삐끗한 일로 증상이 있다.,어머..어쩌다가 그러셨어요.. ,몸이 보내는 신호를 무시하거나 참지 마세요.,통증을 느낄 때에는 충분히 휴식을 취하세요.,통증을 방치하지 마세요. 자칫하면 더 큰 증상으로 발전할 수 있어요.,통증을 자주 느끼시는 건 아닌지 걱정돼요.,부기나 통증이 있는지 잘 살펴 보세요.,증상을 방치하면 만성 질환으로 이어지는 수가 있어요. 초기 치료가 중요해요.,통증이 어느 정도 지속됐는지 떠올려 보세요.치료 시기를 놓치지 마세요.
